text,label_id,label,display_name,source_type,text_length,word_count
Denial reason: The plan does not cover this item in the submitted setting. Validate supporting information before appeal. action: confirm payer rule. [audit reference REF000435],4,not_covered,Coverage / Benefit Exclusion,synthetic_rarc_style,177,25
"Claim review note: Claim lacks documentation required by payer policy. action: route to denial prevention team. Coverage appears active, but another payer rule may still apply. [claim reference REF000688]",8,documentation,Documentation,synthetic_rarc_style,204,29
Denial reason: Referral information is missing or incomplete. Additional follow-up is required. (DOS 2023-06-20) [prebill reference REF000141],2,authorization,Authorization / Referral,synthetic_rarc_style,142,17
Adjudication message: Required attachment was not included with the clm. Additional follow-up is required. (DOS 2023-05-19) [case reference REF000499],8,documentation,Documentation,synthetic_rarc_style,150,19
Remark: Claim denied because the benefit category does not cover this service. Correct and resubmit if appropriate. [audit reference REF000357],4,not_covered,Coverage / Benefit Exclusion,synthetic_rarc_style,143,20
clm review note: Payer requested records were not received. action: confirm payer rule. [prebill reference REF000659],8,documentation,Documentation,synthetic_rarc_style,117,16
Remark: The claim was not submitted within the required timeframe. Please review before resubmission. [claim reference REF000083],5,timely_filing,Timely Filing,synthetic_rarc_style,129,17
"Adjudication message: Claim lacks documentation required by payer policy. Please review before resubmission. (claim ID CLM000683) Documentation may be available, but the record should be confirmed. [claim reference REF000683]",8,documentation,Documentation,synthetic_rarc_style,225,29
Remark: Additional documentation is needed before claim review can continue. Validate supporting information before appeal. action: attach support if available. [claim reference REF000149],8,documentation,Documentation,synthetic_rarc_style,188,23
Remark: Medicare secondary payer information is required. Validate supporting information before appeal. (claim ID CLM000136) [case reference REF000136],7,coordination_of_benefits,Coordination of Benefits,synthetic_rarc_style,152,18
remark: authorization expired before the date of service. route to the responsible rcm workqueue. (claim line 2) [claim reference REF000222],2,authorization,Authorization / Referral,synthetic_rarc_style,140,20
"Claim review note: Prior authorization was required but not found; Validate supporting information before appeal; (claim line 7) The service may be covered, but another denial condition should be reviewed. [case reference REF000300]",2,authorization,Authorization / Referral,synthetic_rarc_style,232,33
"Payer response: Claim format issue requires correction before payment. (claim ID CLM000508) The service may be covered, but another denial condition should be reviewed. [prebill reference REF000508]",9,other,Other Administrative,synthetic_rarc_style,198,27
REMARK: SUBMISSION EXCEEDED THE PAYER'S FILING LIMIT. CORRECT AND RESUBMIT IF APPROPRIATE. workqueue: pre-bill review. [case reference REF000098],5,timely_filing,Timely Filing,synthetic_rarc_style,145,18
denial reason: another payer is primary and must process the claim first. correct and resubmit if appropriate. (payer edit EDT-722) [case reference REF000332],7,coordination_of_benefits,Coordination of Benefits,synthetic_rarc_style,158,23
This decision was based on a National Coverage Determination (NCD). An NCD provides a coverage determination as to whether a particular item or procedure is covered. Visit CMS.gov and search for Medicare Coverage Database to find a copy of the policy.,6,medical_necessity,Medical Necessity,official_rarc,251,41
Denial reason: Coverage was suspended when the claim line was rendered. (DOS 2023-04-03) action: route to denial prevention team. [case reference REF000204],0,eligibility,Eligibility / Coverage,synthetic_rarc_style,156,22
"Denial reason: Operative note or clinical report is missing. Correct and resubmit if appropriate. (encounter ENC39167) Filing date appears within the normal workflow, but the payer response remains unresolved. [claim reference REF000115]",8,documentation,Documentation,synthetic_rarc_style,237,32
payer response: repeat billing detected for the same procedure. correct and resubmit if appropriate. (claim ID CLM000106) status: analyst review recommended. [audit reference REF000106],3,duplicate_claim,Duplicate Claim,synthetic_rarc_style,185,24
No appeal right except duplicate claim/treatment issue. This treatment was included in a claim that has been previously billed and adjudicated.,3,duplicate_claim,Duplicate Claim,official_rarc,143,21
"Payer response: The approved authorization does not match the billed procedure; (claim ID CLM000106) status: analyst review recommended. Coding was reviewed, but payer edits may still require follow-up. [audit reference REF000106]",2,authorization,Authorization / Referral,synthetic_rarc_style,230,31
"Adjudication message: Diagnosis and documentation do not justify the service. Route to the responsible RCM workqueue. (claim line 11) Other insurance information may be current, but payer sequencing should be checked. [prebill reference REF000235]",6,medical_necessity,Medical Necessity,synthetic_rarc_style,247,34
Repeat billing detected for the same procedure. Correct and resubmit if appropriate. (claim ID CLM000021) [case reference REF000021],3,duplicate_claim,Duplicate Claim,synthetic_rarc_style,132,18
Missing/incomplete/invalid trauma activation sheet.,8,documentation,Documentation,official_rarc,51,4
REMARK: THE APPROVED AUTHORIZATION DOES NOT MATCH THE BILLED PROCEDURE. VALIDATE SUPPORTING INFORMATION BEFORE APPEAL. (review batch B405) [audit reference REF000001],2,authorization,Authorization / Referral,synthetic_rarc_style,166,21
PAYER RESPONSE: CLINICAL NOTES ARE INSUFFICIENT TO VALIDATE THE ENCOUNTER. (DOS 2023-07-01) status: analyst review recommended. [prebill reference REF000486],8,documentation,Documentation,synthetic_rarc_style,157,19
Denial reason: The code billed is not payable with the submitted modifier. Correct and resubmit if appropriate. [claim reference REF000322],1,coding_error,Coding Error,synthetic_rarc_style,139,20
Adjudication message: This claim appears to duplicate a previously submitted claim. Route to the responsible RCM workqueue. (DOS 2023-05-01) status: analyst review recommended. [review reference REF000059],3,duplicate_claim,Duplicate Claim,synthetic_rarc_style,205,26
Remark: Operative note or clinical report is missing. Correct and resubmit if appropriate. [claim reference REF000700],8,documentation,Documentation,synthetic_rarc_style,118,16
adjudication message: claim contains inconsistent administrative information. validate supporting information before appeal. (claim ID CLM000230) [case reference REF000230],9,other,Other Administrative,synthetic_rarc_style,172,18
"Remark: Service was already billed for the same patient and date; (payer edit EDT-711) Other insurance information may be current, but payer sequencing should be checked. [case reference REF000045]",3,duplicate_claim,Duplicate Claim,synthetic_rarc_style,197,29
"Secondary payer cannot process without primary payer adjudication. (review batch B592) Filing date appears within the normal workflow, but the payer response remains unresolved. [review reference REF000052]",7,coordination_of_benefits,Coordination of Benefits,synthetic_rarc_style,206,27
Adjudication message: Coordination of benefits information is missing or outdated. (DOS 2023-08-06) action: attach support if available. [case reference REF000274],7,coordination_of_benefits,Coordination of Benefits,synthetic_rarc_style,163,20
"The claim line matches a prior paid or pending line. Correct and resubmit if appropriate. (encounter ENC22441) Eligibility was checked separately, but the line still needs review. [prebill reference REF000132]",3,duplicate_claim,Duplicate Claim,synthetic_rarc_style,209,30
This claim/claim line is not payable under our claims jurisdiction area. You can identify the correct Medicare contractor to process this claim/claim line through the CMS website at www.cms.gov.,9,other,Other Administrative,official_rarc,194,29
Payer response: Clinical notes are insufficient to validate the service. Validate supporting information before appeal. workqueue: pre-bill review. [review reference REF000830],8,documentation,Documentation,synthetic_rarc_style,176,21
Adjudication message: Policy number was not valid for the submitted date of service. Please review before resubmission. (payer edit EDT-958) action: attach support if available. [prebill reference REF000098],0,eligibility,Eligibility / Coverage,synthetic_rarc_style,207,28
"Claim review note: The claim was not submitted within the required timeframe. Please review before resubmission. (payer edit EDT-962) workqueue: pre-bill review. Filing date appears within the normal workflow, but the payer response remains unresolved. [prebill reference REF000050]",5,timely_filing,Timely Filing,synthetic_rarc_style,282,38
Medical records are required to support this claim; Validate supporting information before appeal; (payer edit EDT-824) [prebill reference REF000271],8,documentation,Documentation,synthetic_rarc_style,149,19
payer response: the submitted procedure duplicates another claim in carrier records. validate supporting information before appeal. (review batch B327) [case reference REF000053],3,duplicate_claim,Duplicate Claim,synthetic_rarc_style,178,22
PAYER RESPONSE: BENEFIT LIMITATIONS DO NOT ALLOW PAYMENT FOR THIS SERVICE; ADDITIONAL FOLLOW-UP IS REQUIRED; (claim ID CLM000213) action: confirm payer rule. [review reference REF000213],4,not_covered,Coverage / Benefit Exclusion,synthetic_rarc_style,186,25
Claim review note: Coverage policy excludes the billed procedure. Route to the responsible RCM workqueue. (payer edit EDT-337) action: confirm payer rule. [audit reference REF000158],4,not_covered,Coverage / Benefit Exclusion,synthetic_rarc_style,182,25
"COB records indicate another plan has payment responsibility. Correct and resubmit if appropriate. (claim line 4) workqueue: pre-bill review. Filing date appears within the normal workflow, but the payer response remains unresolved. [claim reference REF000148]",7,coordination_of_benefits,Coordination of Benefits,synthetic_rarc_style,260,35
Claim review note: Secondary payer cannot process without primary payer adjudication; Please review before resubmission; (payer edit EDT-910) status: analyst review recommended. [audit reference REF000314],7,coordination_of_benefits,Coordination of Benefits,synthetic_rarc_style,205,25
Authorization was denied before claim submission. Correct and resubmit if appropriate. [review reference REF000287],2,authorization,Authorization / Referral,synthetic_rarc_style,115,14
Payer response: Claim lacks documentation required by payer policy. Correct and resubmit if appropriate. (encounter ENC52516) [case reference REF000549],8,documentation,Documentation,synthetic_rarc_style,152,19
"The HCPCS code requires a more specific billing modifier. Validate supporting information before appeal. (payer edit EDT-688) The service may be covered, but another denial condition should be reviewed. [review reference REF000325]",1,coding_error,Coding Error,synthetic_rarc_style,231,32
Payer response: Coverage terminated before the submitted service was performed. Please review before resubmission. status: analyst review recommended. [claim reference REF000217],0,eligibility,Eligibility / Coverage,synthetic_rarc_style,178,21
Claim review note: Plan records show the subscriber was not eligible for benefits. Correct and resubmit if appropriate. (review batch B367) [review reference REF000093],0,eligibility,Eligibility / Coverage,synthetic_rarc_style,168,24
"Payer response: Subscriber was not enrolled in the plan on the service date; Route to the responsible RCM workqueue; (DOS 2023-04-17) workqueue: pre-bill review. Medical necessity support may exist, but the claim needs final analyst review. [audit reference REF000185]",0,eligibility,Eligibility / Coverage,synthetic_rarc_style,268,39
"Remark: Corrected claim was submitted outside the allowed window. Correct and resubmit if appropriate. action: attach support if available. The service may be covered, but another denial condition should be reviewed. [audit reference REF000149]",5,timely_filing,Timely Filing,synthetic_rarc_style,244,34
Adjudication message: Member coverage was inactive on the date of service. Correct and resubmit if appropriate. (review batch B821) [audit reference REF000079],0,eligibility,Eligibility / Coverage,synthetic_rarc_style,159,22
Adjudication message: Benefits must be coordinated with the patient's primary carrier. Please review before resubmission. (review batch B278) action: confirm payer rule. [case reference REF000173],7,coordination_of_benefits,Coordination of Benefits,synthetic_rarc_style,196,25
Remark: Submitted information does not meet coverage determination criteria. Validate supporting information before appeal. (DOS 2023-06-03) [prebill reference REF000248],6,medical_necessity,Medical Necessity,synthetic_rarc_style,170,19
"Payer response: The code billed is not payable with the submitted modifier. workqueue: pre-bill review. Authorization details may be present, but the claim still needs validation. [audit reference REF000251]",1,coding_error,Coding Error,synthetic_rarc_style,207,29
Other coverage information conflicts with payer records. Additional follow-up is required. [claim reference REF000427],7,coordination_of_benefits,Coordination of Benefits,synthetic_rarc_style,118,14
Crossover claim denied by previous carrier and complete claim data not forwarded. Resubmit this claim to this carrier to provide adequate data for adjudication.,7,coordination_of_benefits,Coordination of Benefits,official_rarc,160,24
"denial reason: claim contains inconsistent administrative information. validate supporting information before appeal. (claim line 11) workqueue: pre-bill review. The service may be covered, but another denial condition should be reviewed. [case reference REF000206]",9,other,Other Administrative,synthetic_rarc_style,265,33
clm REVIEW NOTE: MEDICARE SECONDARY PAYER INFORMATION IS REQUIRED. PLEASE REVIEW BEFORE RESUBMISSION. (encounter ENC19324) status: analyst review recommended. [audit reference REF000196],7,coordination_of_benefits,Coordination of Benefits,synthetic_rarc_style,186,22
Medical code sets used must be the codes in effect at the time of encounter.,1,coding_error,Coding Error,official_rarc,76,15
"Medicare secondary payer information is required. Additional follow-up is required. (payer edit EDT-691) status: analyst review recommended. Authorization details may be present, but the claim still needs validation. [review reference REF000051]",7,coordination_of_benefits,Coordination of Benefits,synthetic_rarc_style,245,31
"Adjudication message: Coverage was suspended when the service was rendered. Route to the responsible RCM workqueue. (DOS 2023-09-14) Authorization details may be present, but the claim still needs validation. [case reference REF000033]",0,eligibility,Eligibility / Coverage,synthetic_rarc_style,235,32
Payer response: Procedure code is invalid for the submitted claim format. Route to the responsible RCM workqueue. action: verify before resubmission. [audit reference REF000433],1,coding_error,Coding Error,synthetic_rarc_style,177,24
Benefits must be coordinated with the subscriber's primary carrier. Route to the responsible RCM workqueue. [review reference REF000253],7,coordination_of_benefits,Coordination of Benefits,synthetic_rarc_style,136,18
Payer response: Submission did not meet health plan processing requirements. Route to the responsible RCM workqueue. (review batch B514) [review reference REF000494],9,other,Other Administrative,synthetic_rarc_style,165,22
ADJUDICATION MESSAGE: CLAIM CONTAINS A CODE COMBINATION THAT REQUIRES CORRECTION. (review batch B407) action: confirm payer rule. [prebill reference REF000273],1,coding_error,Coding Error,synthetic_rarc_style,159,20
"Adjudication message: Other coverage information conflicts with Medicare contractor records. (payer edit EDT-180) Coding was reviewed, but payer edits may still require follow-up. [audit reference REF000224]",7,coordination_of_benefits,Coordination of Benefits,synthetic_rarc_style,207,26
Denial reason: Service is not covered under the patient's benefit plan; Please review before resubmission; (claim line 8) status: analyst review recommended. [audit reference REF000441],4,not_covered,Coverage / Benefit Exclusion,synthetic_rarc_style,185,25
"Remark: Billing information could not be validated by insurer; Additional follow-up is required; (claim line 5) action: attach support if available. Other insurance information may be current, but payer sequencing should be checked. [prebill reference REF000350]",9,other,Other Administrative,synthetic_rarc_style,262,36
Remark: Diagnosis and documentation do not justify the service. Please review before resubmission. (DOS 2023-05-01) [claim reference REF000095],6,medical_necessity,Medical Necessity,synthetic_rarc_style,143,18
Claim review note: Referral was required before the service could be covered. (encounter ENC46639) action: confirm payer rule. [case reference REF000028],2,authorization,Authorization / Referral,synthetic_rarc_style,153,21
Adjudication message: Medical necessity review determined the service was not justified. Correct and resubmit if appropriate. (claim line 4) [claim reference REF000016],6,medical_necessity,Medical Necessity,synthetic_rarc_style,168,22
Submission exceeded the payer's filing limit; Route to the responsible RCM workqueue; (DOS 2023-05-20) action: verify before resubmission. [claim reference REF000112],5,timely_filing,Timely Filing,synthetic_rarc_style,166,21
"Remark: A matching claim has already been paid; Validate supporting information before appeal; (payer edit EDT-562) action: verify before resubmission. Authorization details may be present, but the claim still needs validation. [audit reference REF000281]",3,duplicate_claim,Duplicate Claim,synthetic_rarc_style,255,34
Patient ineligible for this claim line.,0,eligibility,Eligibility / Coverage,official_rarc,39,6
Adjudication message: Claim line requires corrected coding before processing. Please review before resubmission. action: verify before resubmission. [audit reference REF000431],1,coding_error,Coding Error,synthetic_rarc_style,176,20
"Patient coverage was inactive on the date of service. Please review before resubmission. Coverage appears active, but another payer rule may still apply. [case reference REF000097]",0,eligibility,Eligibility / Coverage,synthetic_rarc_style,180,26
Claim review note: Payer records show this service was already adjudicated; Correct and resubmit if appropriate; status: analyst review recommended. [claim reference REF000100],3,duplicate_claim,Duplicate Claim,synthetic_rarc_style,176,23
Missing radiology report.,8,documentation,Documentation,official_rarc,25,3
The level of service is not supported by clinical information. Correct and resubmit if appropriate. [prebill reference REF000231],6,medical_necessity,Medical Necessity,synthetic_rarc_style,129,18
REMARK: BENEFITS MUST BE COORDINATED WITH THE PATIENT'S PRIMARY CARRIER; PLEASE REVIEW BEFORE RESUBMISSION; (review batch B732) [audit reference REF000252],7,coordination_of_benefits,Coordination of Benefits,synthetic_rarc_style,155,20
claim review note: submitted cpt code is not valid for the provider specialty. validate supporting information before appeal. (encounter ENC65552) [review reference REF000150],1,coding_error,Coding Error,synthetic_rarc_style,175,23
"Remark: Prior authorization was required but not found. Additional follow-up is required. No duplicate was confirmed during intake, but adjudication notes still require review. [review reference REF000019]",2,authorization,Authorization / Referral,synthetic_rarc_style,205,27
Denial reason: Benefits must be coordinated with the patient's primary carrier. Validate supporting information before appeal. (review batch B334) [case reference REF000270],7,coordination_of_benefits,Coordination of Benefits,synthetic_rarc_style,173,22
Not covered when performed during the same session/date as a previously processed procedure for the claimant.,3,duplicate_claim,Duplicate Claim,official_rarc,109,16
"Claim review note: Order, report, or supporting record is missing. Please review before resubmission. (encounter ENC67568) [review reference REF000253]",8,documentation,Documentation,synthetic_rarc_style,151,19
"Payer response: Benefit limitations do not allow payment for this service. (payer edit EDT-607) Medical necessity support may exist, but the claim needs final analyst review. [prebill reference REF000134]",4,not_covered,Coverage / Benefit Exclusion,synthetic_rarc_style,204,29
Denial reason: Clinical notes are insufficient to validate the service. Route to the responsible RCM workqueue. (review batch B521) action: route to denial prevention team. [review reference REF000626],8,documentation,Documentation,synthetic_rarc_style,201,28
"Payer response: Submission did not meet payer processing requirements. Validate supporting information before appeal. Filing date appears within the normal workflow, but the payer response remains unresolved. [audit reference REF000328]",9,other,Other Administrative,synthetic_rarc_style,236,30
"Denial reason: Clinical notes are insufficient to validate the encounter. Validate supporting information before appeal. Other insurance information may be current, but payer sequencing should be checked. [claim reference REF000092]",8,documentation,Documentation,synthetic_rarc_style,232,30
Denial reason: Medical records are required to support this claim. Route to the responsible RCM workqueue. (encounter ENC31960) [case reference REF000141],8,documentation,Documentation,synthetic_rarc_style,154,21
Remark: The service exceeded the authorized number of visits. Please review before resubmission. action: attach support if available. [audit reference REF000027],2,authorization,Authorization / Referral,synthetic_rarc_style,161,21
Remark: Clinical notes are insufficient to validate the service. Validate supporting information before appeal. status: analyst review recommended. [audit reference REF000430],8,documentation,Documentation,synthetic_rarc_style,175,21
Claim review note: Corrected claim was submitted outside the allowed window. Additional follow-up is required. (DOS 2023-07-10) status: analyst review recommended. [prebill reference REF000024],5,timely_filing,Timely Filing,synthetic_rarc_style,193,24
REMARK: CLAIM CONTAINS INCONSISTENT ADMINISTRATIVE INFORMATION. ADDITIONAL FOLLOW-UP IS REQUIRED. (claim ID CLM000370) status: analyst review recommended. [prebill reference REF000370],9,other,Other Administrative,synthetic_rarc_style,184,20
remark: administrative issue prevented claim adjudication. additional follow-up is required. (review batch B598) action: verify before resubmission. [audit reference REF000063],9,other,Other Administrative,synthetic_rarc_style,176,20
Claim review note: Insurer requested additional review before final adjudication. Route to the responsible RCM workqueue. (claim line 1) [review reference REF000400],9,other,Other Administrative,synthetic_rarc_style,165,22
Payer response: Referral was required before the service could be covered. (claim line 4) action: attach support if available. [case reference REF000182],2,authorization,Authorization / Referral,synthetic_rarc_style,153,22
Procedure code is invalid for the submitted claim format. Correct and resubmit if appropriate. action: route to denial prevention team. [prebill reference REF000214],1,coding_error,Coding Error,synthetic_rarc_style,165,23
Payer response: Additional documentation is needed before claim review can continue. Validate supporting information before appeal. (encounter ENC68776) [audit reference REF000336],8,documentation,Documentation,synthetic_rarc_style,180,21
Medical necessity review determined the service was not justified. Correct and resubmit if appropriate. (claim ID CLM000164) [review reference REF000164],6,medical_necessity,Medical Necessity,synthetic_rarc_style,153,20
"Remark: Referral information is missing or incomplete. Correct and resubmit if appropriate. (DOS 2023-09-26) status: analyst review recommended. Coverage appears active, but another payer rule may still apply. [prebill reference REF000294]",2,authorization,Authorization / Referral,synthetic_rarc_style,239,31
"Denial reason: Procedure and diagnosis coding are inconsistent. Route to the responsible RCM workqueue. (claim ID CLM000193) action: confirm payer rule. Eligibility was checked separately, but the line still needs review. [audit reference REF000193]",1,coding_error,Coding Error,synthetic_rarc_style,249,34
Payer response: Clinical notes are insufficient to validate the treatment. Validate supporting information before appeal. (DOS 2023-09-19) [case reference REF000818],8,documentation,Documentation,synthetic_rarc_style,165,20
"Payer response: Other coverage information conflicts with Medicare contractor records. Validate supporting information before appeal. (review batch B424) status: analyst review recommended. Filing date appears within the normal workflow, but the payer response remains unresolved. [claim reference REF000192]",7,coordination_of_benefits,Coordination of Benefits,synthetic_rarc_style,308,38
