text,label_id,label,display_name,source_type,text_length,word_count
"payer response: the svc is not a payable benefit for this member. please review before resubmission. Documentation may be available, but the record should be confirmed. [prebill reference REF000416]",4,not_covered,Coverage / Benefit Exclusion,synthetic_rarc_style,198,29
Adjudication message: Payer policy identifies the service as investigational or excluded. Additional follow-up is required. [case reference REF000182],4,not_covered,Coverage / Benefit Exclusion,synthetic_rarc_style,150,18
"Claim review note: Other coverage information conflicts with carrier records. Route to the responsible RCM workqueue. (review batch B368) action: confirm payer rule. Coverage appears active, but another payer rule may still apply. [review reference REF000146]",7,coordination_of_benefits,Coordination of Benefits,synthetic_rarc_style,259,36
Payer response: Claim contains inconsistent administrative information. (DOS 2023-02-28) [prebill reference REF000535],9,other,Other Administrative,synthetic_rarc_style,118,12
Remark: Subscriber ID does not match active health plan records; Please review before resubmission; action: confirm payer rule. [audit reference REF000005],0,eligibility,Eligibility / Coverage,synthetic_rarc_style,155,21
Remark: Payer policy does not support necessity based on submitted diagnosis. Correct and resubmit if appropriate. (review batch B287) [case reference REF000010],6,medical_necessity,Medical Necessity,synthetic_rarc_style,161,22
Claim review note: Submitted documentation is incomplete for the billed service. Please review before resubmission. (DOS 2023-10-08) [review reference REF000793],8,documentation,Documentation,synthetic_rarc_style,161,20
Claim review note: The code billed is not payable with the submitted modifier. Route to the responsible RCM workqueue. (encounter ENC40465) [review reference REF000235],1,coding_error,Coding Error,synthetic_rarc_style,168,24
Payer response: Payer requested records were not received. Route to the responsible RCM workqueue. (review batch B118) action: confirm payer rule. [case reference REF000410],8,documentation,Documentation,synthetic_rarc_style,173,24
claim review note: claim requires manual review due to health plan processing rules. correct and resubmit if appropriate. (claim ID CLM000140) [case reference REF000140],9,other,Other Administrative,synthetic_rarc_style,169,24
Adjudication message: Referral information is missing or incomplete. Please review before resubmission. (review batch B137) action: attach support if available. [audit reference REF000209],2,authorization,Authorization / Referral,synthetic_rarc_style,188,23
"This decision was based on a Local Coverage Determination (LCD). An LCD provides a guide to assist in determining whether a particular item or claim line is covered. A copy of this policy is available at www.cms.gov/mcd, or if you do not have web access, you may contact the contractor to request a copy of the LCD.",6,medical_necessity,Medical Necessity,official_rarc,315,57
"claim review note: diagnosis and documentation do not justify the service. correct and resubmit if appropriate. Coding was reviewed, but payer edits may still require follow-up. [audit reference REF000146]",6,medical_necessity,Medical Necessity,synthetic_rarc_style,205,29
PAYER RESPONSE: SERVICE IS BUNDLED INTO ANOTHER PAYABLE PROCEDURE. VALIDATE SUPPORTING INFORMATION BEFORE APPEAL. (claim ID CLM000325) action: attach support if available. [case reference REF000325],4,not_covered,Coverage / Benefit Exclusion,synthetic_rarc_style,198,25
Remark: Claim requires manual review due to Medicare contractor processing rules. Validate supporting information before appeal. (DOS 2023-09-20) [claim reference REF000065],9,other,Other Administrative,synthetic_rarc_style,173,21
Denial reason: Modifier is missing or inconsistent with the billed encounter. Correct and resubmit if appropriate. (encounter ENC61290) [review reference REF000319],1,coding_error,Coding Error,synthetic_rarc_style,164,21
"Claim review note: Order, report, or supporting record is missing. Additional follow-up is required. (DOS 2023-08-14) action: route to denial prevention team. [review reference REF000023]",8,documentation,Documentation,synthetic_rarc_style,187,25
Adjudication message: Operative note or clinical report is missing. Please review before resubmission. (review batch B905) action: attach support if available. [case reference REF000383],8,documentation,Documentation,synthetic_rarc_style,186,24
Denial reason: Procedure and diagnosis coding are inconsistent. Correct and resubmit if appropriate. [prebill reference REF000344],1,coding_error,Coding Error,synthetic_rarc_style,130,16
"Records indicate this patient was a prisoner or in custody of a Federal, State, or local authority when the procedure was rendered. This health plan does not cover items and services furnished to an individual while he or she is in custody under a penal statute or rule, unless under State or local law, the individual is personally liable for the cost of his or her health care while in custody and the State or local government pursues the collection of such debt in the same way and with the same vigor as the collection of its other debts. The provider can collect from the Federal/State/ Local Authority as appropriate.",0,eligibility,Eligibility / Coverage,official_rarc,624,110
Claim review note: Claim requires updated other-insurance information; (claim ID CLM000007) [review reference REF000007],7,coordination_of_benefits,Coordination of Benefits,synthetic_rarc_style,120,14
Remark: Payer order could not be determined from submitted information. (claim line 2) [prebill reference REF000129],7,coordination_of_benefits,Coordination of Benefits,synthetic_rarc_style,116,16
"Claim review note: The submitted svc duplicates another claim in insurer records. Additional follow-up is required. Medical necessity support may exist, but the claim needs final analyst review. [review reference REF000161]",3,duplicate_claim,Duplicate Claim,synthetic_rarc_style,223,31
"Remark: Coverage terminated before the submitted service was performed. Please review before resubmission. (claim ID CLM000069) action: confirm payer rule. Other insurance information may be current, but payer sequencing should be checked. [prebill reference REF000069]",0,eligibility,Eligibility / Coverage,synthetic_rarc_style,269,35
Medical records are required to support this claim. Route to the responsible RCM workqueue. (payer edit EDT-278) action: route to denial prevention team. [claim reference REF000376],8,documentation,Documentation,synthetic_rarc_style,181,26
Remark: Service is bundled into another payable procedure. Please review before resubmission. (payer edit EDT-233) [prebill reference REF000095],4,not_covered,Coverage / Benefit Exclusion,synthetic_rarc_style,144,18
Adjudication message: Service is bundled into another payable procedure; Correct and resubmit if appropriate; (claim line 12) workqueue: pre-bill review. [claim reference REF000320],4,not_covered,Coverage / Benefit Exclusion,synthetic_rarc_style,181,23
Missing oxygen certification/re-certification.,8,documentation,Documentation,official_rarc,46,3
"Diagnosis submitted does not meet payer medical necessity criteria. Validate supporting information before appeal. (encounter ENC68232) Coding was reviewed, but payer edits may still require follow-up. [prebill reference REF000234]",6,medical_necessity,Medical Necessity,synthetic_rarc_style,231,29
Claim must be submitted by the provider who rendered the service.,7,coordination_of_benefits,Coordination of Benefits,official_rarc,65,11
Denial reason: Authorization expired before the date of service. Additional follow-up is required. (DOS 2023-01-25) [prebill reference REF000270],2,authorization,Authorization / Referral,synthetic_rarc_style,145,18
Claim review note: Claim filing period expired before payer receipt. (review batch B994) action: route to denial prevention team. [audit reference REF000203],5,timely_filing,Timely Filing,synthetic_rarc_style,157,22
Claim review note: Service is bundled into another payable procedure. Please review before resubmission. [review reference REF000004],4,not_covered,Coverage / Benefit Exclusion,synthetic_rarc_style,133,17
Remark: Pre-certification was not obtained before treatment. Validate supporting information before appeal. (payer edit EDT-996) action: route to denial prevention team. [review reference REF000114],2,authorization,Authorization / Referral,synthetic_rarc_style,198,24
"clm review note: Duplicate submission identified for provider, patient, and date. Additional follow-up is required. (encounter ENC29624) action: confirm payer rule. Documentation may be available, but the record should be confirmed. [review reference REF000018]",3,duplicate_claim,Duplicate Claim,synthetic_rarc_style,261,34
The code billed is not payable with the submitted modifier. Additional follow-up is required. (claim line 7) [claim reference REF000367],1,coding_error,Coding Error,synthetic_rarc_style,136,20
Patient ineligible for this service.,0,eligibility,Eligibility / Coverage,official_rarc,36,5
"Adjudication message: Coverage policy excludes the billed procedure; (payer edit EDT-556) action: verify before resubmission. Coding was reviewed, but payer edits may still require follow-up. [audit reference REF000040]",4,not_covered,Coverage / Benefit Exclusion,synthetic_rarc_style,219,28
"plan records show the member was not eligible for benefits. validate supporting information before appeal. (review batch B943) The service may be covered, but another denial condition should be reviewed. [claim reference REF000041]",0,eligibility,Eligibility / Coverage,synthetic_rarc_style,231,33
"Adjudication message: Payer received the claim after the contractual deadline. action: route to denial prevention team. Medical necessity support may exist, but the claim needs final analyst review. [audit reference REF000020]",5,timely_filing,Timely Filing,synthetic_rarc_style,226,31
Claim review note: The service is not a payable benefit for this subscriber. Route to the responsible RCM workqueue. action: confirm payer rule. [audit reference REF000303],4,not_covered,Coverage / Benefit Exclusion,synthetic_rarc_style,172,26
"Administrative issue prevented claim adjudication. (claim line 3) action: attach support if available. Authorization details may be present, but the claim still needs validation. [claim reference REF000077]",9,other,Other Administrative,synthetic_rarc_style,206,27
Denial reason: Pre-certification was not obtained before treatment; Validate supporting information before appeal; (payer edit EDT-364) [case reference REF000131],2,authorization,Authorization / Referral,synthetic_rarc_style,162,19
"Remark: Submission exceeded the payer's filing limit. Correct and resubmit if appropriate. (DOS 2023-05-18) The service may be covered, but another denial condition should be reviewed. [prebill reference REF000060]",5,timely_filing,Timely Filing,synthetic_rarc_style,214,29
Procedure denied because payment already made for same/similar procedure within set time frame.,3,duplicate_claim,Duplicate Claim,official_rarc,95,13
Claim line is not covered when subscriber is under age 45.,4,not_covered,Coverage / Benefit Exclusion,official_rarc,58,11
Payer response: Administrative issue prevented clm adjudication. (encounter ENC46890) [prebill reference REF000304],9,other,Other Administrative,synthetic_rarc_style,115,12
Payer response: Claim line is not considered medically necessary for the reported condition. Additional follow-up is required. (encounter ENC64205) workqueue: pre-bill review. [case reference REF000111],6,medical_necessity,Medical Necessity,synthetic_rarc_style,202,25
"Denial reason: Other coverage information conflicts with insurer records. Additional follow-up is required. action: confirm payer rule. Filing date appears within the normal workflow, but the payer response remains unresolved. [case reference REF000105]",7,coordination_of_benefits,Coordination of Benefits,synthetic_rarc_style,253,33
PAYER RESPONSE: PROCEDURE AND DIAGNOSIS CODING ARE INCONSISTENT; (claim ID CLM000179) action: route to denial prevention team. [claim reference REF000179],1,coding_error,Coding Error,synthetic_rarc_style,154,20
Payer response: Documentation does not support the billed procedure details. Correct and resubmit if appropriate. (DOS 2023-12-03) [case reference REF000099],8,documentation,Documentation,synthetic_rarc_style,157,20
"The information furnished does not substantiate the need for this level of procedure. If you have collected any amount from the claimant for this level of procedure/any amount that exceeds the limiting charge for the less extensive procedure, the law requires you to refund that amount to the claimant within 30 days of receiving this notice.",6,medical_necessity,Medical Necessity,official_rarc,342,56
Adjudication message: Coverage policy excludes the billed procedure. Additional follow-up is required. (encounter ENC62542) [review reference REF000209],4,not_covered,Coverage / Benefit Exclusion,synthetic_rarc_style,152,17
Denial reason: Submitted documentation is incomplete for the billed service; Validate supporting information before appeal; status: analyst review recommended. [review reference REF000833],8,documentation,Documentation,synthetic_rarc_style,188,22
"Payer response: Authorization number is invalid for this procedure. Additional follow-up is required. (claim ID CLM000307) action: route to denial prevention team. The service may be covered, but another denial condition should be reviewed. [case reference REF000307]",2,authorization,Authorization / Referral,synthetic_rarc_style,267,37
Adjudication message: The HCPCS code requires a more specific billing modifier. (DOS 2023-12-24) status: analyst review recommended. [case reference REF000006],1,coding_error,Coding Error,synthetic_rarc_style,159,20
"Remark: Proof of timely filing is required for review. Coverage appears active, but another payer rule may still apply. [case reference REF000175]",5,timely_filing,Timely Filing,synthetic_rarc_style,146,22
Remark: Claim denied because the benefit category does not cover this treatment. Validate supporting information before appeal. (payer edit EDT-318) [review reference REF000366],4,not_covered,Coverage / Benefit Exclusion,synthetic_rarc_style,177,23
"Claim review note: COB records indicate another plan has payment responsibility. Please review before resubmission. (claim ID CLM000345) status: analyst review recommended. Authorization details may be present, but the claim still needs validation. [case reference REF000345]",7,coordination_of_benefits,Coordination of Benefits,synthetic_rarc_style,275,36
Adjudication message: The submitted service duplicates another claim in payer records. Please review before resubmission. (DOS 2023-12-18) [claim reference REF000268],3,duplicate_claim,Duplicate Claim,synthetic_rarc_style,166,20
Adjudication message: Payer policy identifies the service as investigational or excluded. Validate supporting information before appeal. (encounter ENC60546) [case reference REF000041],4,not_covered,Coverage / Benefit Exclusion,synthetic_rarc_style,184,21
"Denial reason: Required attachment was not included with the claim; Please review before resubmission; (review batch B814) No duplicate was confirmed during intake, but adjudication notes still require review. [review reference REF000392]",8,documentation,Documentation,synthetic_rarc_style,238,32
"Payer response: A matching claim has already been paid. (claim line 2) Other insurance information may be current, but payer sequencing should be checked. [audit reference REF000154]",3,duplicate_claim,Duplicate Claim,synthetic_rarc_style,182,27
Payer response: Payer requested additional review before final adjudication. Route to the responsible RCM workqueue. [audit reference REF000320],9,other,Other Administrative,synthetic_rarc_style,144,18
Patient not enrolled in Electronic Visit Verification System.,0,eligibility,Eligibility / Coverage,official_rarc,61,8
Statutorily excluded claim line(s).,0,eligibility,Eligibility / Coverage,official_rarc,35,4
Adjudication message: Clinical notes are insufficient to validate the treatment. (claim ID CLM000003) [case reference REF000003],8,documentation,Documentation,synthetic_rarc_style,128,16
Claim review note: Claim requires updated other-insurance information; Route to the responsible RCM workqueue; (review batch B271) action: route to denial prevention team. [claim reference REF000262],7,coordination_of_benefits,Coordination of Benefits,synthetic_rarc_style,199,26
"Denial reason: Unclassified denial reason requires analyst review. Additional follow-up is required. (review batch B453) action: confirm payer rule. No duplicate was confirmed during intake, but adjudication notes still require review. [audit reference REF000474]",9,other,Other Administrative,synthetic_rarc_style,263,34
Claim review note: Late submission prevents payment under plan rules. Additional follow-up is required. (encounter ENC31989) [prebill reference REF000086],5,timely_filing,Timely Filing,synthetic_rarc_style,154,19
Late submission prevents payment under plan rules. Validate supporting information before appeal. [case reference REF000229],5,timely_filing,Timely Filing,synthetic_rarc_style,124,15
"Remark: Claim format issue requires correction before payment. Please review before resubmission. (review batch B332) Coding was reviewed, but payer edits may still require follow-up. [audit reference REF000470]",9,other,Other Administrative,synthetic_rarc_style,211,28
Payer response: The HCPCS code requires a more specific billing modifier; workqueue: pre-bill review. [review reference REF000062],1,coding_error,Coding Error,synthetic_rarc_style,130,17
"Claim review note: Diagnosis and documentation do not justify the service; Correct and resubmit if appropriate; (review batch B302) Eligibility was checked separately, but the line still needs review. [claim reference REF000276]",6,medical_necessity,Medical Necessity,synthetic_rarc_style,228,32
Adjudication message: Payer received the claim after the contractual deadline. (DOS 2023-09-07) workqueue: pre-bill review. [audit reference REF000262],5,timely_filing,Timely Filing,synthetic_rarc_style,151,18
Provider/supplier not accredited for product/encounter.,9,other,Other Administrative,official_rarc,55,5
Payer response: Claim lacks documentation required by insurer policy. Route to the responsible RCM workqueue. (DOS 2023-03-28) [claim reference REF000634],8,documentation,Documentation,synthetic_rarc_style,154,20
"Remark: This claim appears to duplicate a previously submitted claim. Please review before resubmission. Coding was reviewed, but payer edits may still require follow-up. [prebill reference REF000218]",3,duplicate_claim,Duplicate Claim,synthetic_rarc_style,200,27
"Denial reason: Coding edit indicates the billed service conflicts with payer rules. Correct and resubmit if appropriate. (encounter ENC88275) workqueue: pre-bill review. Coding was reviewed, but payer edits may still require follow-up. [case reference REF000045]",1,coding_error,Coding Error,synthetic_rarc_style,262,35
Claim contains a code combination that requires correction. Validate supporting information before appeal. (claim line 7) [audit reference REF000311],1,coding_error,Coding Error,synthetic_rarc_style,149,19
"Adjudication message: Referral information is missing or incomplete. Route to the responsible RCM workqueue. workqueue: pre-bill review. med necessity support may exist, but the claim needs final analyst review. [claim reference REF000325]",2,authorization,Authorization / Referral,synthetic_rarc_style,239,32
PAYER RESPONSE: HEALTH PLAN REQUESTED RECORDS WERE NOT RECEIVED. ROUTE TO THE RESPONSIBLE RCM WORKQUEUE. (claim ID CLM000727) [review reference REF000727],8,documentation,Documentation,synthetic_rarc_style,154,21
"Submitted documentation is incomplete for the billed svc. Documentation may be available, but the record should be confirmed. [review reference REF000757]",8,documentation,Documentation,synthetic_rarc_style,154,21
Medical records are required to support this claim; Route to the responsible RCM workqueue; (review batch B972) [case reference REF000651],8,documentation,Documentation,synthetic_rarc_style,138,20
"Payer response: Medical records are required to support this claim. (claim line 11) action: confirm payer rule. Eligibility was checked separately, but the line still needs review. [case reference REF000588]",8,documentation,Documentation,synthetic_rarc_style,207,30
Remark: This clm appears to duplicate a previously submitted claim. Validate supporting information before appeal. (payer edit EDT-858) action: route to denial prevention team. [prebill reference REF000025],3,duplicate_claim,Duplicate Claim,synthetic_rarc_style,206,27
Denial reason: Payer system returned a general processing denial. (claim line 6) [claim reference REF000505],9,other,Other Administrative,synthetic_rarc_style,108,15
"The information furnished does not substantiate the need for this level of procedure. If you have collected any amount from the patient for this level of procedure/any amount that exceeds the limiting charge for the less extensive procedure, the law requires you to refund that amount to the patient within 30 days of receiving this notice.",6,medical_necessity,Medical Necessity,official_rarc,340,56
The svc exceeded the authorized number of visits. Additional follow-up is required. (DOS 2023-12-20) [audit reference REF000279],2,authorization,Authorization / Referral,synthetic_rarc_style,128,17
Missing/incomplete/invalid diagnosis or condition.,1,coding_error,Coding Error,official_rarc,50,4
"Secondary payer cannot process without primary payer adjudication. Route to the responsible RCM workqueue. (claim line 2) Filing date appears within the normal workflow, but the payer response remains unresolved. [case reference REF000195]",7,coordination_of_benefits,Coordination of Benefits,synthetic_rarc_style,239,33
Adjudication message: Another carrier is primary and must process the claim first. Validate supporting information before appeal. action: confirm payer rule. [review reference REF000099],7,coordination_of_benefits,Coordination of Benefits,synthetic_rarc_style,186,24
"Adjudication message: Patient was not enrolled in the plan on the service date. Please review before resubmission. (DOS 2023-05-10) No duplicate was confirmed during intake, but adjudication notes still require review. [review reference REF000017]",0,eligibility,Eligibility / Coverage,synthetic_rarc_style,247,34
Claim review note: Documentation does not support the billed procedure details. Correct and resubmit if appropriate. (claim line 6) [prebill reference REF000345],8,documentation,Documentation,synthetic_rarc_style,161,22
"claim review note: procedure lacks clinical indication under payer guidelines. (review batch B668) Filing date appears within the normal workflow, but the payer response remains unresolved. [claim reference REF000134]",6,medical_necessity,Medical Necessity,synthetic_rarc_style,217,29
"DENIAL REASON: PAYER SYSTEM RETURNED A GENERAL PROCESSING DENIAL. (claim ID CLM000479) action: route to denial prevention team. Coverage appears active, but another payer rule may still apply. [case reference REF000479]",9,other,Other Administrative,synthetic_rarc_style,219,31
Claim review note: The submitted service duplicates another claim in payer records. Route to the responsible RCM workqueue. (review batch B783) [case reference REF000097],3,duplicate_claim,Duplicate Claim,synthetic_rarc_style,170,24
Denial reason: Claim lacks documentation required by payer policy. Validate supporting information before appeal. [audit reference REF000364],8,documentation,Documentation,synthetic_rarc_style,141,17
"The billed service is considered non-covered for this plan. Please review before resubmission. status: analyst review recommended. Coding was reviewed, but payer edits may still require follow-up. [prebill reference REF000009]",4,not_covered,Coverage / Benefit Exclusion,synthetic_rarc_style,226,30
"Payer response: Operative note or clinical report is missing; Please review before resubmission; (claim ID CLM000550) workqueue: pre-bill review. Filing date appears within the normal workflow, but the payer response remains unresolved. [audit reference REF000550]",8,documentation,Documentation,synthetic_rarc_style,264,35
Documentation does not support that the services rendered were medically necessary.,6,medical_necessity,Medical Necessity,official_rarc,83,11
"Denial reason: Documentation does not support the billed procedure details. Please review before resubmission. (claim ID CLM000653) Documentation may be available, but the record should be confirmed. [case reference REF000653]",8,documentation,Documentation,synthetic_rarc_style,226,30
Denial reason: Documentation does not support the billed procedure details. Please review before resubmission. (payer edit EDT-775) action: confirm payer rule. [prebill reference REF000266],8,documentation,Documentation,synthetic_rarc_style,189,24
payer response: corrected claim was submitted outside the allowed window. correct and resubmit if appropriate. (claim ID CLM000172) [audit reference REF000172],5,timely_filing,Timely Filing,synthetic_rarc_style,159,21
"Remark: Provider enrollment or billing status requires review. Validate supporting information before appeal. (review batch B402) Documentation may be available, but the record should be confirmed. [case reference REF000242]",9,other,Other Administrative,synthetic_rarc_style,224,29
